{
  "basicInfo": {
    "name": "Ariana Vex",
    "role": "Smuggler",
    "faction": "Independent Traders Guild",
    "avatar": "https://example.com/avatars/ariana.png",
    "reputation": "Known for her daring escapes and questionable cargo.",
    "background": "A veteran of the outer rim trade routes, she's seen it all.",
    "firstImpression": "Sharp eyes and a quick wit, not easily fooled."
  },
  "personality": {
    "openness": 70,
    "conscientiousness": -20,
    "extraversion": 50,
    "agreeableness": -10,
    "neuroticism": 40
  },
  "relationshipToPlayer": {
    "affinity": -40,
    "notes": "Distrusts the player due to past betrayal, but is intrigued by their skills."
  },
  "preferences": {
    "attractedToTraits": ["confidence", "independence", "wit"],
    "dislikesTraits": ["authority", "cowardice", "arrogance"],
    "gossipTendency": "high"
  }
}
